{
  "$schema": "https://json-schema.org/draft/2020-12/schema",
  "$schemaVersion": "0.0.1",
  "$id": "https://raw.githubusercontent.com/smart-data-models/Candidates/master/standards/gaiax-ontology-v2111/models/ServiceTermsAndConditions/schema.json",
  "modelTags": "GaiaX,Ontology,Legal",
  "title": "Smart Data Models - Gaia-X Ontology - ServiceTermsAndConditions",
  "description": "https://w3id.org/gaia-x/2.1.11#class/ServiceTermsAndConditions. Terms and Conditions applying to a digital service offering.",
  "type": "object",
  "properties": {
    "id": {
      "type": "string",
      "format": "uri",
      "description": "Property. Unique identifier of the entity"
    },
    "type": {
      "type": "string",
      "enum": [
        "ServiceTermsAndConditions"
      ],
      "description": "Property. NGSI-LD Entity type. It must be equal to 'ServiceTermsAndConditions'"
    },
    "dateCreated": {
      "type": "string",
      "format": "date-time",
      "description": "Property. Model:'https://schema.org/DateTime'. Entity creation timestamp."
    },
    "dateModified": {
      "type": "string",
      "format": "date-time",
      "description": "Property. Model:'https://schema.org/DateTime'. Timestamp of the last modification."
    },
    "source": {
      "type": "string",
      "description": "Property. A sequence of characters giving the source of the entity data."
    },
    "dataProvider": {
      "type": "string",
      "description": "Property. A sequence of characters identifying the provider of the harmonised data entity."
    },
    "url": {
      "type": "string",
      "format": "uri",
      "description": "Property. A resolvable link to the terms & conditions document."
    },
    "hash": {
      "type": "string",
      "description": "Property. SHA-256 hash of the document."
    }
  },
  "required": [
    "id",
    "type",
    "url",
    "hash"
  ]
}
