{
  "id": "urn:ngsi-ld:ServiceTermsAndConditions:001",
  "type": "ServiceTermsAndConditions",
  "dateCreated": "2026-08-20T10:00:00Z",
  "dateModified": "2026-08-20T10:00:00Z",
  "source": "https://docs.gaia-x.eu/ontology/v2111/classes/ServiceTermsAndConditions/",
  "dataProvider": "Gaia-X AISBL",
  "url": "https://example.org/legal/service-terms-001.pdf",
  "hash": "9f86d081884c7d659a2feaa0c55ad015a3bf4f1b2b0b822cd15d6c15b0f00a08"
}
